title,subtitle,author,synopsis,title_type,mission
Strength in the Storm,"Transform Stress, Live in Balance, and Find Peace of Mind",Eknath Easwaran,"As I mentioned in the other Notes on his work, Eknath Easwaran is one of my favorite teachers. He was a professor of English literature in India before coming to America on a Fulbright scholarship. He taught at UC Berkeley and became one of the world’s leading meditation and spiritual teachers. In this book, we learn how to love storms—how to use simple tools to find strength in the inevitable storms of life as we “transform stress, live in balance and find peace of mind.” Big Ideas we explore: “I love storms.” -Gandhi, Eudaimantra (how I came up w/the perfect mantra for myself), how to end all boredom, time as an infinite cosmic carpet, the secret of life (in one sentence) and Gandhi 101: how to become fearless.",PhilosophersNotes,Meditation
Stillness Speaks,,,"This is our third Note on one of Eckhart Tolle’s great books. We started with The Power of Now. Then A New Earth. And, here we are with Stillness Speaks. It's a super-quick reading and equally deep-thought provoking little book. PACKED with wisdom. In fact, it’s one of those books we could (literally!) open up to a random page and have a great chat for a weekend. (Hah. Seriously.) Big Ideas we explore include how to connect to the truth (hint: remove what's in the way), the importance of stillness and silence (and the negative effects of solitude deprivation), spontaneous right action (aka wu-wei!), hearing voices in your head (and what to do about it), taking empowered action (sit or stand; don't wobble) and embracing the 'isles' of life (drop the labels!).",PhilosophersNotes,Meditation
Peace Is Every Step,The Path of Mindfulness in Everyday Life,Thich Nhat Hanh,"A humble Buddhist monk, Thich Nhat Hanh is one of the most revered spiritual leaders on the planet. This book is a collection of wisdom from his talks and private conversations and is packed with peaceful wisdom. In the Note, we’ll explore Big Ideas ranging from the importance of our breath and what he calls “mouth yoga” (aka smiling :) to how we can practice engaged mindfulness.",PhilosophersNotes,Meditation
Anxiety Free,Stop Worrying and Quieten Your Mind - Featuring the Buteyko Breathing Method and Mindfulness,Patrick McKeown,"This is a quick-reading, simple, practical guide to, as the sub-title suggests, “Stop Worrying and Quieten Your Mind—Featuring the Buteyko Breathing Method and Mindfulness.” If you’re looking for a general introduction to the power of Oxygen, I’d recommend you go with Patrick’s more recent and more all-purpose Oxygen Advantage. If you suffer from anxiety and/or panic attacks, this might be a great place to start. Big Ideas we explore: The #1 rule of breathing, the 2 key benefits of putting your attention on your breath, why CO2 is your friend and how to play nice, avoiding rat poison and becoming a good mind gardener.",PhilosophersNotes,Meditation
Fully Engaged,Using the Practicing Mind in Daily Life,Thomas M. Sterner,"Thomas Sterner wrote the great book The Practicing Mind (see Notes). This is a follow-up practical guide to applying the concepts in that book to our daily lives. It’s a great little book packed with wisdom and zero fluff. Having the ability to do be fully (!) engaged in this moment is the ultimate super power. Big Ideas we explore include: how to be fully engaged, the #1 goal of meditation, how to get in total control of your life, goal poison, premeditated procedures, and the powerful question: “And then what?”",PhilosophersNotes,Meditation
"No Mud, No Lotus",The Art of Transforming Suffering,Thich Nhat Hanh,"Thich Nhat Hanh is one of the world’s leading Buddhist monks. He is a true master and it’s a joy to connect with his powerful wisdom. I picked this book off the shelf after fires nearly burned down our town. It felt like a good time to remind myself of the fact that the good life is not—and cannot be—exclusively “good” times. Want a beautiful lotus flower? Embrace the mud. No mud, no lotus. Want a wonderful, flourishing life? Embrace the challenges. No challenges, no flourishing. Big Ideas we explore include: suffering goes with happiness, lotus flowers don’t grow in marble, feed the good stuff, the first thing to do when suffering strikes (breathe!), billions of funerals/b-days every day, the two arrows, and why the Buddha meditated after becoming the Buddha.",PhilosophersNotes,Meditation
Everyday Enlightenment,The Twelve Gateways to Personal Growth,Dan Millman,"This is Dan Millman's magnum opus where he walks us through ""The Twelve Gateways to Personal Growth"" and in the Note we check out Big Ideas ranging from the importance of discovering our self-worth (and how to do so) to the fact that, although ""Carpe diem!"" sounds good, it's impossible to do. We can’t ""Seize the day!"" but we *can* ""Seize the moment!"" or , as Dan says: ""Carpe punctum!""",PhilosophersNotes,Meditation
#20 How to Stop Thinking,The #1 Tip on How to Master this Important Lost Art,,"Patrick McKeown is one of the world’s leading experts on optimal breathing. When I interviewed him recently, he made a very interesting",+1s,Meditation
"#320 You, Buddha and Your Fundies",Why Buddha Kept Meditating Post-Enlightenment,,"In No Mud, No Lotus, Thich Nhat Hanh tells us that when he was a young monk he thought the Buddha never suffered. Then, as he matured, he",+1s,Meditation
#335 Meet Your Telomeres,Your New BFFs - Think: Aglets + Offensive Linemen,,Elizabeth Blackburn won a Nobel Prize for her research on telomerase — the enzyme that nourishes our telomeres. She wrote a book called,+1s,Meditation
#1293 Heroic Meditation,Breath + Heroes + Virtues + Stillness + Quest,,"In our last +1, we talked about my new Heroic Mantra Meditation practice. Our one-word mantra? Areté.",+1s,Meditation
#394 Start Again,And Again and Again and Again…,,"In our last +1, we talked about the renowned Vipassana meditation teacher S.N. Goenka and his mantra: “Work diligently. Diligently. Work",+1s,Meditation
#395 Strong Determination,How’s Yours?,,"Continuing our theme of S.N. Goenka-inspired wisdom, let’s chat about something he calls “Strong Determination.” First, context.",+1s,Meditation
#396 Impermanence,"""Anicca, Anicca, Anicca""",,"Continuing our fun little recap of wisdom picked up at an S.N. Goenka Vipassana retreat, let’s talk about impermanence. We’ll do so via",+1s,Meditation
#452 The Space,Between Stimulus and Response,,Viktor Frankl was a remarkable human being. He was a leading psychotherapist before suffering the horrors of Nazi concentration camps. He,+1s,Meditation
#611 AI vs. HC,A Quick Accounting,,"In our last +1, we talked about Byron Katie’s investment strategy and putting your focus on the most important stock market out there:",+1s,Meditation
#670 Meditation’s Instant ROI,Trouble Falling Asleep? Cut It in Half!,,"Meditation. At this point, most of us are pretty aware of the fact that it’s been proven to be pretty epic for our well-being. Congrats,",+1s,Meditation
#671 The Magic Pill of Meditation,Do You Take It? (Science Says…),,"In our last +1, we talked about meditation’s instant ROI. Quick recap: Stanford science says that if you have trouble sleeping, you can",+1s,Meditation
#672 Just Brush Your Brain,Meditation’s 1 + 2 + 3 + 4,,"In our last couple of +1s, we had fun looking at how to cut 15 minutes off the time it takes us to fall asleep by popping the magical",+1s,Meditation
#677 Interbeing,"Qi Gong, Thich Nhat Hanh, You, Me, and Rain Drops",,In our last +1 we talked about those two 50-pound sandbags I got to carry back to the car yesterday after someone decided to go Beastmode on,+1s,Meditation
#709 The Optimus Meditation,Aka the Optimize Virtue Meditation,,"In our last +1, we had fun with our virtual Optimus Medallion. The first batch of medallions hot off the Optimize mint (hah!) will be",+1s,Meditation
#710 Virtue Mantras,(Super Helpful!) Tools for the Mind,,"In our last couple +1s, we talked about the 11 virtues that show up on our shiny new Optimus medallions and make an appearance in our",+1s,Meditation
#711 More on Mantras,via Eknath Easwaran (the Indian Joseph Campbell),,"In our last +1, we chatted about mantras and took (yet!) another trip down Etymology Lane where we discovered that the word mantra literally",+1s,Meditation
#712 How to Train Your Mind,Remember the Elephant’s Trunk,,"In our last couple +1s, we’ve been having fun working with some tools for the mind—also known as mantras. Today I’d like to tap into",+1s,Meditation
#859 The Invisible Gorilla,And the Spotlight of Your Attention,,Have you ever heard about the Invisible Gorilla? Insert1: Spoiler alert coming for those who haven’t heard of it yet! Insert2: Watch this,+1s,Meditation
#941 The 5 D’s of Meditation,"Do It with Dignity, a Defined Anchor and Strong Determination Then Do It Again",,Yesterday I led a session with our Coaches on our fifth Fundamental: Be Present. (Preceded by Eat + Move + Sleep + Breathe and to be,+1s,Meditation
#299 The Inner-net vs. The Internet,One Has All the Real Answers,,"In Life Visioning, Michael Beckwith tells us we need to turn off the Internet and plug into the Inner-net. We THINK the Internet has all",+1s,Meditation
#1243 Eudaimantra,How to Extend Sovereignty Over the Mind,,Earlier today I wrapped up a few Time Blocks of (pre-inputs) Deep Work (3.9 hours to be precise!) as I finished my Note on Mark Hyman’s,+1s,Meditation
#392 Blissipline,Bliss + Discipline = Secret Sauce,,Michael Beckwith coined one of my favorite words: blissipline. Two parts: Bliss + Discipline. This brilliant thought from Beckwith captures,+1s,Meditation
"#393 Work Diligently, Patiently and Persistently",And You’re Bound to Be Successful,,"In our last +1, we talked about the power of blissipline. Bliss + Discipline = Boom! When I think about bringing discipline to our lives",+1s,Meditation
#53 Little by Little,The Buddha on How to Optimize,,"One of my favorite gems from the Buddha is this wisdom: “Little by little one becomes evil, as a water pot is filled with water. Little by",+1s,Meditation
#228 There Are No Enlightened Beings,Only More or Less Enlightened Moments,,"In our last +1, we talked about the fact that we can’t seize the day per se—we can only seize the moment. Enter: Carpe punctum. In",+1s,Meditation
#519 How to Create a World-Class Mind,"Hint: Train It for 10,000+ Hours",,"In our last +1, we talked about the fact that Yuval Noah Harari doesn’t have a smartphone. He’s basically written an algorithm that",+1s,Meditation
#942 Moment to Moment to Moment,to Moment to Moment to Moment…,,"In our last +1, we meditated with Emerson and chatted about the 5 D’s of Meditation: Do it with Dignity and a Defined anchor with strong",+1s,Meditation
#1005 Thoughts + Heartbeats,Meditating? Thoughts Are NOT Your Enemy!,,"Emily Fletcher was a Broadway performer living the dream. Only… Her hair was graying at 27, she was always stressed and had chronic",+1s,Meditation
#1006 Brushing Our Brains,Here’s Your Brainbrush,,"In our last +1, we spent some time with Emily Fletcher and reflected on her meditation wisdom that thoughts are not our enemies. As she",+1s,Meditation
#1143 Virtuegong,Qigong + Virtue for the Win!,,"I’ve been doing a super-simple Qigong practice for years. (Thank you, Michael Gelb for getting the balls rolling!!) Every.single.time I",+1s,Meditation
#1150 Cover It All in Leather,Or… Just Wrap Leather Around Your Feet,,"In our last +1, we tapped into some wisdom from Brené Brown’s Braving the Wilderness as we wrote ourselves a permission slip and then",+1s,Meditation
#326 Napitations,Nap + Meditation = Magic,,"The other day I was taking a little napitation and I thought to myself, “Self, you should do a +1 on Napitations.” So, here we are. 🤓",+1s,Meditation
#484 Your Optimal Breathing Rate,You Know It? Science Says…,,"In our last +1, we talked about the new sexy: vagal tone. It’s essentially a measure of the health of our parasympathetic nervous system",+1s,Meditation
#1234 A Wandering Mind,Is an Unhappy Mind,,"Not too long ago we spent some time with the brilliant neuroscientist Ian Robertson, discussing some Ideas from his great book The Winner",+1s,Meditation
#916 Training Tranquility,Today for TONIGHT for Tomorrow,,"In our +1 on the Top 10 Sleep Kryptonites, we briefly discussed the fact that “Anxiety” is one of the top reasons people give for Why We",+1s,Meditation
#1039 Frankl on Freedom,See That Gap Between Stimulus and Response?,,"In our last +1, we hopped off the bus driven by Vice sponsored by the casino and hopped on the bus driven by Virtue packed with our favorite",+1s,Meditation
#1001 Start Again (and Again...),And Again... And Again... And...,,"In our last +1 (#1,000!!), we celebrated our gritty Optimizers who have hammered all 1,000 +1s. One more time: Go you. Welcome to the",+1s,Meditation
#779 An Increasingly Healthy Mind,Sam Harris on the Real (Near) Goal,,"Sam Harris is a very smart and very wise man. As you may know, he’s part neuroscientist, part philosopher, part mystic. In his great book",+1s,Meditation
#98 The Equanimity Game,How to Play It Like an Emperor,,"In our last +1, we talked about getting really good at recovering from our inevitable glitches. My favorite way to do that? I like to think",+1s,Meditation
#1241 Breathing Together,Inspiring → Conspiring to Optimize,,"Last night I got to hang out with 23 Optimizers in their virtual Optimize Local Zoom hangout. It was amazing. (Thank you, Khaled and Asma,",+1s,Meditation
#1008 SEALs and WIRMs,Witness + Interdict + Redirect + Maintain,,"Not too long ago, we shared a +1 on what I called “Thought Alchemy.” It was all about “How to Change One Thought for Another.” That",+1s,Meditation
How God Changes Your Brain,,Andrew Newberg M.D. & Mark Waldman,"Andrew Newberg and Mark Robert Waldman are academics from the University of Pennsylvania’s Center for Spirituality and the Mind. In this great book, they walk us through how God (or any spiritual practices in general) can, as the title suggests, changes our brains! Big Ideas we explore in the Note include the power if intention, the science of neuroplasticity and how meditation and exercise effect your brain!",PhilosophersNotes,Meditation
Optimal Nutrition 101,"How to optimize your health, energy and happiness starting at the end of your fork",,"Nutrition. It’s easy to get lost in the labyrinth of conflicting science. In this class, we focus on the 2 facts Michael Pollan tells us we can all agree on and then look at how to eliminate the primary causes of disease caused by our modern diets. Optimizing our health, energy and happiness starts at the end of our fork!",101 Classes,Nutrition
Food 101,How to feel empowered around food and fuel your awesomely authentic life,,,101 Classes,Nutrition
Cooking 101,What you can do on a daily basis to optimize your nutrition in an easy and practical way,,Join Alexandra and me in the Johnson kitchen for ten of our favorite recipes!,101 Classes,Nutrition
Food Rules,An Eater's Manual,Michael Pollan,"Energy, Nutrition, Modern Classic Michael Pollan is the author of a number of New York Times best-selling books on nutrition. In 2010, Time magazine named him one of the one hundred most influential people in the world. If you’re looking for a SUPER compact, witty look at the primary rules on how to eat well, this is it. It’s a fun, witty, concise guide to eating well featuring 64 food rules structured around Pollan’s seven words of wisdom: Eat food. Not too much. Mostly plants. Big Ideas we explore include the 2 Facts of nutrition everyone can agree on, Rule #1, why low-fat made us fat, and the final rule (#64).",PhilosophersNotes,Nutrition
In Defense of Food,An Eater's Manifesto,Michael Pollan,"Michael Pollan is one of the world’s leading thinkers on nutrition. Time magazine voted him one of the 100 most influential people in the world. He’s also a Professor of Journalism at UC Berkeley. One of the things I most love about him and his work is that, as a journalist, he takes a much wider, more objective view of the nutritional landscape—which can often be dominated by (and muddled by) individuals with *very* strong, dogmatic, inflexible ideologies. Big Ideas we explore: Nutritionism (vs. food), the big experiment (that failed), the Aborigine in all of us, the 5 fundamental transformations of industrializing food and Lucky Charms, Cocoa Puff and Trix cereals as health foods as per the American Heart Association. (<— Can you believe that? Crazy. And true.)",PhilosophersNotes,Nutrition
Bright Line Eating,"The Science of Living Happy, Thin & Free",Susan Peirce Thompson,"Susan Peirce Thompson is a Professor of Brain and Cognitive Sciences at the University of Rochester. She’s an expert in the psychology of eating and creator of Bright Line Eating Solutions, “a company dedicated to helping people achieve long-term, sustainable weight loss.” Plus... She used to be obese and, as she says, addicted to *everything.* She integrates her background in neuroscience with her personal experience conquering her diet and other addiction issues in this super popular book. Big Ideas we explore include why bright lines are where it’s at, the susceptibility quiz, the saboteur, self-perception theory, and the four bright lines of eating.",PhilosophersNotes,Nutrition
Power Up Your Brain,,"David Perlmutter, MD & Alberto Villoldo, Ph.D.","Q: What do you get when you combine a neuroscientist and a shaman? A: This book! Specifically, as the sub-title suggests we get: “The Neuroscience of Enlightenment."" This is a great book. In the Note, we take a quick look at the power of mitochondria, how to move from our amygala to our prefrontal cortex, how to use stress to our advantage, and create new nueral superhighways.",PhilosophersNotes,Nutrition
The Case for Keto,Rethinking Weight Control and the Science and Practice of Low-Carb/High-Fat Eating,Gary Taubes,"We’ve featured two of Gary Taubes’ other great books: Why We Get Fat and The Case Against Sugar. If you or a loved one have struggled with reaching your optimal weight while trying to follow the conventional wisdom that all you have to do is eat less and exercise more, I think you, too, will enjoy Taubes’s thoughtful perspective on just how flawed our current thinking is regarding the cause of obesity. Hint: It’s not an “energy balance” issue; it’s primarily a HORMONAL issue. The book is PACKED with Big Ideas. As in, jumbo packed. Hope you love the Note!",PhilosophersNotes,Nutrition
The Bulletproof Diet,"Lose up to a Pound a Day, Reclaim Energy and Focus, Upgrade Your Life",Dave Asprey,"Want to get Bulletproof? Then Dave Asprey is your man. An uber-successful entrepreneur who weighed 300 lbs before bio-hacking his way to optimal awesome, Dave gives us a guide to upgrading our lives. Big Ideas include the 10 Diet Myths, inflamma, fruits and vegetables, and making health a means to a much bigger end.",PhilosophersNotes,Nutrition
The Thrive Diet,"The Whole Food Way to Losing Weight, Reducing Stress and Staying Healthy for Life",,"Brendan Brazier is a former professional Ironman triathlete who lived on nothing but plant-based foods—no meat, no dairy… just plants. In the Note, we'll explore some Big Ideas on how to optimize our diets and experience more vitality in our lives as we quit leaking energy, go for high net-gain foods and rock the alkalinity!",PhilosophersNotes,Nutrition
Eat to Live,The Revolutionary Formula for Fast and Sustained Weight Loss,Joel Fuhrman,"This book is REALLY REALLY good. In fact, I’m gonna say that if you take the time to read only *one* book on nutrition, read this one. Integrating scientific research plus his experience treating over 10,000 patients with common sense and fun, Dr. Joel Fuhrman has created a super-readable book with a challenging, yet approachable nutrition program that can completely change your life. Big Ideas we explore in the Note include the importance of really committing, what nutritional density is all about and other goodness.",PhilosophersNotes,Nutrition
Fat for Fuel,"A Revolutionary Diet to Combat Cancer, Boost Brain Power, and Increase Your Energy",Dr. Joseph Mercola,"Dr. Mercola is a super-popular alternative health physician who runs the equally popular site Mercola.com. In this book, we get a look at his “Mitochondrial Metabolic Therapy” program. MMT for short. As you could probably guess, this is a high-fat (+ “adequate” protein + low-carb) diet. If that approach fires you up, I think you’ll love the book. If not, well… :) Big Ideas we explore include: meeting our mitochondria (the key to health), why “adequate” protein is where it’s at (not low or moderate or high but “adequate”!), mTOR (the cancer switch), good fats (vs. bad ones), peak fasting, and how to win the urge war.",PhilosophersNotes,Nutrition
The Case Against Sugar,,Gary Taubes,"Gary Taubes is an award-winning science journalist. He’s a Robert Wood Johnson Foundation Investigator in Health Policy Research at the University of California, Berkeley School of Public Health. In this book, we take up the case against sugar as the primary suspect for ALL of the chronic diseases that are killing us. As the back cover says, Taubes “makes the convincing case that sugar is the tobacco of the new millennium: backed by powerful lobbies, entrenched in our lives, and making us very sick.” Big Ideas we explore include: the prime suspect (= sugar), drug or food?, two theories (energy balance vs. metabolic theory), sugar as a chronic toxin (vs. acute), sugar as candy for cancer cells, and the big question: how little is too much?",PhilosophersNotes,Nutrition
Natural Born Heroes,Mastering the Lost Secrets of Strength and Endurance,Christopher McDougall,"Christopher McDougall is a brilliant story teller (and author of Born to Run). In this great book, he weaves together a number of different narratives, with an emphasis on two: one about an extraordinary wartime adventure on Crete and the other about Natural Movement. In the process, he shares a ton of Ideas on how we can each tap into the extraordinary superpowers latent within. Big Ideas we explore include the ancient Greek meaning of the word “hero,” the mantra of the hero, why weeds + fat are optimal fuel and a great test.",PhilosophersNotes,Nutrition
Clean Gut,The Breakthrough Plan for Eliminating the Root Cause of Disease and Revolutionizing Your Health,"Alejandro Junger, M.D.","The gut. That’s where all the health magic (or challenges!) begins. Alejandro Junger is a cardiologist turned functional medicine doctor who created the incredibly popular Clean Program. We covered his first book Clean and now for a spotlight on the Clean Gut. Big Ideas we explore include symptoms vs. root causes (paint any brown leaves green lately?), how food’s shelf life correlates with yours, your 2nd brain, nutrigenomics, gluten (the ubiquitous poison) and step 1 to cleaning things up (hint: remove toxic triggers).",PhilosophersNotes,Nutrition
#170 Eating Sugar in an fMRI Machine,How to Turn Off Your Addiction Center,,"In our last couple +1s, we’ve been hanging out in an fMRI scanning our brains and seeing some fascinating stuff. Let’s stay in there for",+1s,Nutrition
#448 Your New Taste Buds,Just Give ‘em 2 Weeks,,Pop quiz today! Question: Do you know how long it takes for you to grow new taste buds? Whaddya think? Hmmm… Answer: Two weeks. That’s,+1s,Nutrition
#449 Rule #1 of Nutrition,Fountain of Youth vs. Poisons,,"In our last +1, we talked about the fact that your taste buds are all shiny new every two weeks—which is good news if you’re addicted to",+1s,Nutrition
#450 Food Poisons Part 2,What You Might Want to Consider Eliminating,,"In our last +1, we talked about Rule #1 of Nutrition. You remember what it was? Basic idea: It’s not what you start eating that has the",+1s,Nutrition
#685 The Case Against Sugar,Is Very Strong #caseclosed,,Gary Taubes wrote a great book called The Case Against Sugar. Basic idea: If you were a detective in charge of figuring out a series of,+1s,Nutrition
#749 Shelf Life vs. Your Life,Know This: Longer = Shorter,,"This morning as I was opening my bag of Keto Cups (which might be the most addictively tasty treat ever), I noticed the expiration date",+1s,Nutrition
#750 Food Rule #57,“Don’t Get Your Fuel from the Same Place Your Car Does”,,"In our last +1, we explored the relationship between our food rotting and us rotting. Recall: The longer the shelf life of the food we eat,",+1s,Nutrition
#751 The Two Facts of Nutrition,And the One Thing You’ll Do About Them Today,,"In our last couple +1s, we had fun exploring some of Michael Pollan’s Food Rules. I highly recommend his little manifesto of practical",+1s,Nutrition
#752 Food Rule #1: Eat Food,vs. Edible Foodlike Substances,,Let’s continue the Food Rule fun with one more +1 on Michael Pollan’s classic little food manual. Today we’ll explore Food Rule #1.,+1s,Nutrition
#753 Low Fat Made Us Fat,Really? Michael Pollan Says: Yep.,,How about one more little +1 on Michael Pollan’s Food Rules? Here it is: “The forty-year-old campaign to create low- and nonfat versions,+1s,Nutrition
#763 The Happiness Diet,vs. The SAD + MAD Diets,,"In our last +1, we talked about my recent PhilosophersNotes-athon. 25 PN’s in 2.5 days for the win!! One of the Notes I REALLY enjoyed was",+1s,Nutrition
#764 Turning Frowns Upside Down,One Bite at a Time,,"In our last +1, we talked about The Happiness Diet as we did some napkin math on the odds of getting depression based on whether you eat a",+1s,Nutrition
