title,subtitle,author,synopsis,title_type,mission
Raise Your Game,High-Performance Secrets from the Best of the Best,Alan Stein Jr.,"Alan Stein is a peak-performance coach who was immersed in the basketball world for fifteen years and now applies that wisdom to the broader game of life. I’m a huge fan of peak performance books, especially those with sports themes so I enjoyed this book. It’s broken down into three parts, capturing the various roles we play in life and work: Part I: Player, Part II: Coach and Part III: Team. Each section features a set of five core virtues we need to master and integrate across each domain. Big Ideas we explore include the importance of Self-Awareness (it's virtue #1!!), two case studies on discipline (featuring Steph Curry and Kobe Bryant), the comparison game (note: you will always (!) lose), the five virtues of being a great Coach, and one more rep (up Hell on the Hill).",PhilosophersNotes,Sports
Elite Minds,How Winners Think Differently to Create a Competitive Edge and Maximize Success,Dr. Stan Beecham,"Stan Beecham is a sports psychologist who has worked with many of the world’s elite athletes. As per the title of the book, he tells us that it’s their MINDS that make the difference in sustained high levels of performance—creating a competitive edge and maximizing success. Big Ideas we explore include your case of mistaken identity (you're greater than you think), the curse of perfection (remember to play poorly well), the true meaning of the word ""compete"" (= ""to strive WITH"" not against) and of the word ""contest"" (= ""to make a promise""!) your ultimate opponent (fear!!) and the ultimate question: To go or not to go (Answer: GO!!!).",PhilosophersNotes,Sports
Go Long!,My Journey Beyond the Game and the Fame,Jerry Rice,"Jerry Rice is the greatest NFL wide receiver of all time. You might also know him from his Dancing with the Stars awesomeness. And, perhaps most importantly, he seems like a really good guy—committed to being a role model and expressing the best version of himself in everything he does. I always knew Jerry had an extraordinary work ethic and I thought it would be fun to hear about his journey in his own words. And, here we are. Big Ideas we explore include: Jerry on fear (you might be surprised how much fear drove his success), the voices in his head (that wisely said, ""Never quit!""), growth and grit (Jerry is a poster child for the science of both), how to practice (hint: the way you want to play), what he did after breaking the all-time touchdown record (hint: showed up for training the next day THREE hours before everyone else), and the best you (that's what we're chasing!).",PhilosophersNotes,Sports
Win or Learn,Gregor and Me: A Trainer's Journey,John Kavanagh,"John Kavanagh is one of the best MMA coaches in the world. He runs Straight Blast Gym Ireland and has been coaching the superstar Conor McGregor—one of the best MMA fighters in history—since the day he got into MMA and arrived in his gym. John was also Ireland’s first MMA fighter and its first Brazilian jiu-jitsu black belt. Plus, he’s a down-to-earth, humble guy. This is his inspiring story about his journey to the top and it reads like a case study in the growth mindset and grit. Big Ideas we cover include the fact that “Win or Learn” is literally THE PERFECT mantra for the growth mindset, Conor's path from welfare to $100m, the goldfish-bowl effect (need to hop out of your bowl?), standing up and falling down (and then getting back up!), loving what we do as the secret sauce to awesome (science says!!) and remembering that there's no easy route to any destination worth getting to.",PhilosophersNotes,Sports
The New Toughness Training for Sports,Mental Emotional Physical Conditioning from One of the World's Premier Sports Psychologists,James E. Loehr,"Jim Loehr is one of the world’s leading sports psychologists and peak performance experts. In this great book, he tells us how all champions are able to access their Ideal Performance States, why we want to lean into challenges, how to make waves throughout out day and the first rule of toughness.",PhilosophersNotes,Sports
How Bad Do You Want It?,Mastering the Psychology of Mind over Muscle,Matt Fitzgerald,"Matt Fitzgerald is a journalist, coach, sports nutritionist, and author of more than 20 books. In this book, he walks us through the different scientific perspectives on how to tap into our latent potential with a deep dive into what’s known as the “Psychobiological Model.” It’s a super-engaging look at some ridiculously inspiring elite athletes and how they mastered their minds to do some extraordinary things. Big Ideas we explore include a quick look at the psycholobiological model (see: sub-title of the book: Mastering the Psychology of Mind over Muscle), the fire walk of life (how far do you get to your wall?), the psychology of pain (brace yourself!), perfectionism (vs. optimalism), the audience effect (eyeballs = better performance), motivation (= the strongest influence) and Steve Prefontaine's approach to crushing it (""Bring it on!"").",PhilosophersNotes,Sports
The Oxygen Advantage,"Simple, Scientifically Proven Breathing Techniques to Help You Become Healthier, Slimmer, Faster, and Fitter",Patrick McKeown,"Patrick McKeown is one of the world’s leading teachers of the Buteyko Breathing Method which was created in the 1950s by a Russian doctor named Dr. Konstantin Buteyko. McKeown suffered from asthma for decades until he found the Buteyko Method. At which point, he reversed his asthma symptoms and then dedicated his life to helping others optimize their breathing. In this book, he extends the Buteyko Method into an approach he calls the Oxygen Advantage. Big Ideas we cover include the #1 obstacle to optimal breathing, Oxygen Delivery 101, the #1 breathing tip, and how to dial in your sleep.",PhilosophersNotes,Sports
The Road to Sparta,Reliving the Ancient Battle and Epic Run That Inspired the World's Greatest Footrace,Dean Karnazes,"Do you know why we call our modern marathon a marathon? You may think you know the real story behind the very first marathon, but in this captivating, inspiring tale, Dean Karnazes (named by Men’s Health as one of the 100 Fittest Men of All Time) gives us a deeper look at the man who, 2,500 years ago, ran the first ULTRAmarathon and, in doing so, effectively saved Western civilization. :) Big Ideas we explore: a history lesson The Battle of Marathon, why balance doesn’t lead to happiness (and what does), a 24 Hour Fitness with Harvard profs, heroes are ready and how to play the pain game.",PhilosophersNotes,Sports
The Ultra Mindset,"An Endurance Champion's 8 Core Principles for Success in Business, Sports, and Life",Travis Macy,"Travis Macy is best known as the record-setting champion of Leadman—“a sort of six-week Grand Prix of Ultra Endurance” that consists of a jaw-dropping number of challenges. This book is a fun look at the eight principles that make up the Ultra Mindset Travis uses to do extraordinary things. Big Ideas we explore include: Your new mantra, what to do when you don’t feel like it, thinking about thinking, making the choice to give up choice, and never quitting… except when you should quit (w/a great litmus test for when you should/shouldn’t quit).",PhilosophersNotes,Sports
The Mental Edge,Maximize Your Sports Potential with the Mind-Body Connection,Kenneth Baum,"This is an old-school mental training book written for athletes in 1999. When Kenneth Baum wrote it, the mind-body connection wasn’t as well-established as it is now so many of the ideas he shares were cutting-edge at the time. Big Ideas we explore include the power of a desire inferno, DROPing into WOOP, power talk, 26,000 breaths a day, and Maslow’s warning.",PhilosophersNotes,Sports
Be Quick -- But Don't Hurry,Finding Success in the Teachings of a Lifetime,Andrew Hill & John Wooden,"Be quick!! But don't hurry. John Wooden repeat that all.the.time to his players in every.single.practice. We need to live with intensity (!), fully showing up and playing at the edge of our abilities WHILE staying centered. Andy Hill walks us through how he learned how to do that playing under Wooden during their dynasty days.",PhilosophersNotes,Sports
The Champion's Comeback,"How Great Athletes Recover, Reflect, and Re-Ignite",Jim Afremow,"Jim Afremow is one of the world’s leading sports psychologists. We covered his first book The Champion’s Mind. This one is kinda like part 2 in which we look at how the Champion responds to the inevitable (!) setbacks faced on the road to greatness—using those setbacks as opportunities to bounce back and make a sweet comeback. Big Ideas we explore include seeing setbacks as challenges rather than threats, outperforming our contracts, practicing ’till you can’t get it wrong, and the 3 P’s of peak performance.",PhilosophersNotes,Sports
My Fight Your Fight,,Ronda Rousey,"Ronda Rousey is a TOUGH human being. If you’re even remotely familiar with MMA/the UFC, I’m not telling you anything you didn’t already know but reading this book brings the point home even more loud and clear. If you don’t know Ronda, ESPN just voted her the best fighter on the planet. She’s an Olympic medalist in Judo and the biggest (and highest paid!) star in the mixed martial arts world. Imagine if Bruce Lee was alive today. And he was a woman. That’s Ronda Rousey. :)",PhilosophersNotes,Sports
Born to Run,"A Hidden Tribe, Superathletes, and the Greatest Race the World Has Never Seen",Christopher McDougall,"Christopher McDougall is an extraordinary writer and this is a fascinating book. We covered his more recent book Natural Born Heroes in which he profiles World War II Cretan resistance fighters and their amazing physical feats. In this one, Christopher takes us on an incredible journey to meet a hidden tribe that can run forever (well, almost!) and an eclectic group of iconoclastic superathletes who meet them in the Copper Canyons of Mexico to run the greatest race the world has never seen. Big Ideas we cover include the secret power of glee + determination, the two goddesses (wisdom + wealth) and which one to pursue, the beast and how to love it, proper running form, and how to do super-challenging things.",PhilosophersNotes,Sports
Golf Is Not a Game of Perfect,,Bob Rotella,"This book is not only a golf/sports psychology classic, but a great primer on approaching life with the right mindset. If you’re into golf, you’ll love it. Big Ideas we explore include: Being an expander rather than a shrink, smaller targets leading to greater focus, the importance of your short game (in golf AND in life), fear vs. nervousness, paying a caddie to berate you and expectations: the good and the bad.",PhilosophersNotes,Sports
Finding Your Zone,Ten Core Lessons for Achieving Peak Performance in Sports and Life,Michael Lardon,"Would you like to find the Zone more often? Well, yah! Leading sports psychologist Michael Lardon, M.D. shows us how. 10 core lessons. In the Note, we'll look at why you want to have two scorecards, the importance of activation energy (451 degrees, please!!) and how to keep your confidence dialed in.",PhilosophersNotes,Sports
"#552 Positivity, Science of",For Peak Performance in Sports and in Life,,"Continuing our time with world-class CrossFit coach Ben Bergeron, let’s look at another one of his champion characteristics: Positivity.",+1s,Sports
#13 Good Bad Days,Mastering the Art of Playing Badly Well,,Jack Nicklaus once said that the real key to being a great golfer was “playing badly well.” It’s one thing to play well when,+1s,Sports
#57 How to Put on Your (Life-)Socks,Wisdom from the Greatest Coach Ever,,"John Wooden’s UCLA basketball teams won 10 NCAA championships in 12 years, including an 88-game winning streak. (Go Bruins!) ESPN says",+1s,Sports
#539 Jack Nicklaus Never Missed a 3-Foot Putt,Nor Did He Ever Three Putt on the Final Hole,,"In our last couple +1s, we’ve been having fun hanging out with the sports psychologist of Champions, Bob Rotella. We talked about",+1s,Sports
#619 How to Win Forever,After Losing for Over 15 Years,,"In our last couple +1s, we had fun hanging out with Jerry Rice and scoring some touchdowns. Let’s continue our sports theme for a bit",+1s,Sports
#621 How to Be Like Mike,Go All In (Skip the Gatorade),,"In our last +1, we talked about the great Sufi poet Rumi and compared his spiritual intensity with some sports icons. I said Rumi would have",+1s,Sports
#1220 Peak Performance You,Flip the Switch—TODAY!,,"In our last +1, we got an inspiring (Hoosiers-inspired) pep talk from Admiral McRaven right before engaging in our next most important",+1s,Sports
#703 How Bad Do You Want It?,Mind Over Obstacles,,Matt Fitzgerald wrote a great book called How Bad Do You Want It? It’s a great addition to the,+1s,Sports
#856 Practicing with Kobe (At 4am),Wonder What We’ll Work On…,,"In our last +1, we chatted about The Comparison Game with Alan Stein. Remember: The odds of us losing that game are (precisely!) 100%. So…",+1s,Sports
#560 Full Effort = Full Victory,"Gandhi, Matt Damon and Will Smith on Winning",,We’ve been talking a lot about how champions maximize minutes—giving everything they’ve got into being the best versions of,+1s,Sports
#266 Champions Do More,Got 10 Reps? Give Me 11!,,"Continuing our theme of stepping up and into our very own World Champion You Training Camp, let’s have fun with a little practice of mine.",+1s,Sports
#548 Just Execute Your Game Plan,Wooden and Lombardi and You,,"A couple +1s ago, we talked about Vince Lombardi and John Wooden chasing perfection and catching excellence. Today I want to chat about",+1s,Sports
#1256 Conscious Competence,Is Where It’s At,,"As you know if you’ve been following along, I’m a big fan of mental toughness books—whether that’s coming from peak performers in",+1s,Sports
#991 The Peak Performance Equation,Stress + Rest = Growth,,"In our last +1, we talked about some wisdom from Brad Stulberg and Steve Magness’s great book The Passion Paradox. Recall1: We can have",+1s,Sports
#587 Making the Impossible Possible,How to Make It What’s for Breakfast in X Tomorrows,,"As we’ve discussed, Steven Kotler wrote The Rise of Superman. His “No pressure, no diamonds” mantra goes through my head at least a",+1s,Sports
#693 Channeling Mia Hamm,The Vision of a Champion,,Not too long ago we talked about how much I enjoy training in the rain. I mentioned how I start every Trail workout with the same (super,+1s,Sports
#977 Start Strong!,Got Any Starting Lines in Your Life?,,"In our last +1, we talked about the importance of finishing strong. I shared a bit about the origin story of my first business, eteamz. It",+1s,Sports
"#537 Squirrels, Einstein and You",Two Mindsets: Training vs. Trusting,,"In our last +1, we had fun dominating our dishes with Byron Katie. Get this: The same day I was thinking about that, I was driving to my",+1s,Sports
#524 Ambition + Routine,"“Routine, in an Intelligent Person, Is a Sign of Ambition.”",,Daily Rituals is a fascinating book that features brief vignettes of the idiosyncratic habits of 161 of history’s most iconoclastic,+1s,Sports
#311 Ideal Performance State,Emotional Consistency and Peak Performance,,Jim Loehr is one of the world’s leading authorities on peak performance. He and Tony Schwartz wrote The Power of Full Engagement and,+1s,Sports
#645 Boundaries or Burnout,100% On + 100% Off ,,"In our last +1, we talked about how the Peak Performance guys recommend we craft our optimal work-to-rest ratio. Pop quiz: You recall the",+1s,Sports
#604 Interleaving,A Key Way to Learn,,"In Learning 101, we talked about a concept scientists call “interleaving.” The basic idea is simple: If you want to learn something,",+1s,Sports
#1263 The Illusion of Choice,Want Greatness? There Is No Choice,,"We’re kinda on a roll exploring some of Trevor Moawad’s peak performance wisdom from his great book It Takes What It Takes so, I say,",+1s,Sports
#224 Rest Before You’re Tired,Remember Your Heart and Its Billions of Beats,,"Do you know how many times your heart beats in a lifetime? That obviously depends on a number of factors, but for the sake of discussion",+1s,Sports
#857 Practice: When Can I Stop?,Great Ones Say…,,"In our last +1, we hung out with Kobe Bryant and Alan Stein in the gym at 4am. Doing what? HAMMERING our fundamentals, of course. (Fun fact:",+1s,Sports
#705 The Psychology of Pain,Want to Endure More Pain? Science Says: Brace Yourself,,Continuing our exploration of how to endure the pain of walking over burning (psychological) coals in pursuit of the upper limits of our,+1s,Sports
#551 Maximizing Minutes,Ben Bergeron + Dan Millman on Mastery,,A few +1s ago we spent some time with world-champion CrossFit coach Ben Bergeron. Let’s have another quick wisdom session with this,+1s,Sports
#1110 What Great Performance Looks Like,"Look! Up, Up in the Sky!",,"In our last +1, we did some swooping and gliding and hunting with a red-tailed hawk and our bird-watching guide: Carlos Castaneda. Today I",+1s,Sports
#487 Breath Control = Emotional Control,"See: Navy SEALs, All Elite Performers, YOU!",,"Concluding this edition of our breathing series, let’s talk about the fact that BREATH CONTROL = SELF-CONTROL. You know how elite",+1s,Sports
#270 2 Scorecards,One for the Lead + Another for the Lag,,"While we’re on a roll with the 4 Disciplines of Execution, let’s circle back and talk a bit more about the Lead vs. Lag Measures. This",+1s,Sports
#252 Consistency over Intensity,The Secret Sauce to Awesome Sauce,,"After selling my first business over fifteen years ago, I had enough money to spend some time figuring out what I wanted to do when I grew",+1s,Sports
#955 Falling on Your Butt,"Approximately 20,000 Times",,Geoff Colvin’s Talent Is Overrated is a great book. It falls into the “Effort Counts Twice” / Deliberate Practice bucket of how to,+1s,Sports
#1219 SEALs and Hoosiers,Get Your Tape Measure Out and Let’s Go!,,"In our last +1, we made it through one evolution at a time with William McRaven as he endured Hell Week and became a Navy SEAL. Fast forward",+1s,Sports
#1257 “That Works!”,Let’s Do It Again (And Again) (And Again),,"In our last +1, we talked about Trevor Moawad’s distinctions on Conscious Competence from his great book It Takes What It Takes. As we",+1s,Sports
#1280 How to Be a Success,Wisdom from Two World-Class Coaches Named Phil,,"In our last +1, we drew some Venn circles with my Yoda and had fun high fiving God by giving ALL we’ve got. Today I want to chat about",+1s,Sports
#546 Catching Excellence,As We Chase Perfection,,"In our last +1, we talked about Ben Bergeron—the CrossFit Games coach whose athletes have won six world championships. I briefly mentioned",+1s,Sports
#580 Average vs. Elite,How to Practice: Right vs. Wrong,,"In our last +1, we talked about Zen in the Art of Spartan Spear Throwing and the recent installation of a spear throw setup in our backyard,",+1s,Sports
#263 World Champion You Training Camp,What Would Your Life Look Like If THAT Was the Standard?,,"Josh Waitzkin is a fascinating guy. You know that movie Searching for Bobby Fisher featuring a little chess prodigy kid? Well, Josh was that",+1s,Sports
#470 How to Win the Olympic Games,Hint: Compete,,I can’t resist. One more +1 on Aristotle. So… The Olympic Games started in Olympia (not too far outside of Athens) in 776 BC. A few,+1s,Sports
#230 Marginal Gains,Here’s How to Win,,"Once upon a time, no British cyclist had ever won the Tour de France. Over 100 years of trying, and, precisely, zero wins. Then a guy named",+1s,Sports
#602 The Ultimate Anabolic (Pseudo)Steroids,Aka: Training Your Recovery,,"In our last +1, we talked about The Mystery of the Hairy Fingers and how to alchemize suffering into laughter like a five-year-old. 😜 I",+1s,Sports
#622 The Growth Mindset,"Jordan, Picasso and You",,"In our last +1, we talked about how to be like Mike sans the sugar-laden Gatorade. 🤓 I briefly mentioned the fact that Jordan was",+1s,Sports
#28 Emotional Stamina,What to Do When You’re Having a Rough Day,,What do you do when you’re having a rough day? Maybe it starts the moment you wake up and you just don’t feel like doing your normal,+1s,Sports
#629 Sleeping with Tom Brady,And Roger Federer and LeBron James,,Tom Brady is one of the (if not the) greatest football players of all time. He’s won five Super Bowl Championships and is still dominating,+1s,Sports
#630 Want to Be Great?,Find the Time. Find the Energy,,"In our last +1, we talked about LeBron James and the fact that he tries to get 11 to 12 hours of sleep per day when he’s training. (So",+1s,Sports
#647 Alarms: Work-Down vs. Wake-Up,One’s (at Least!) 10x Better than the Other,,"Not too long ago, we chatted about Roger Federer, LeBron James and Tom Brady and how much those all-time greats prioritized sleep. As you",+1s,Sports
1:59,"The Sub-Two-Hour Marathon Is Within Reach―Here's How It Will Go Down, and What It Can Teach All Runners about Training and Racing",Dr. Philip Maffetone,"Phil Maffetone is one of the greatest (if not THE) greatest endurance coaches ever. He’s coached everyone from the best triathlete in history (Mark Allen) to some of the best race car drivers (like the Andretti brothers). He even toured with The Red Hot Chilli Peppers as their wellness coach and helped Rick Rubin Optimize his life. This book is a fun look at Maffetone’s perspective on how to go about breaking the elusive 2-hour marathon. As he says in the sub-title, it’s all about “how it will go down” AND “what it can teach all runners about training and racing.” If you’re a marathoner, this might be the perfect way to get introduced to Maffetone’s core ideas. I loved it as another way to drill Maffetone’s core ideas into my mind and training methodology. It’s basically a holistic look at all the marginal gains we can apply to reach our running potential. Big Ideas we cover include a quick look at just how fast a 1:59 pace is (sub-4:35 min mile for 26.2 miles = CRAZY fast!), the importance of the MIND in hitting the target, why AEROBIC speed is so important (plus, what it is and how to train it), the ideal training schedule (is super dynamic and personal), how to run properly (hot coal technique!), and balancing the catabolic + anabolic phases of training.",PhilosophersNotes,Sports
Spartan Fit!,30 Days. Transform Your Mind. Transform Your Body. Commit to Grit.,Joe De Sena & John Durant,"Joe De Sena is the founder of the Spartan Race. He’s also, as Angela Duckworth, author of Grit, tells us: “a paragon of grit” who “shows you how you’re capable of so much more than you think.” A paragon of grit. That’s the perfect description. After inspiring us with stories of real-life heroes and ancient Spartan lore, De Sena walks us through the seven pillars of Spartan training + a 30-day plan to get Spartan Fit. Big Ideas we explore include getting to the starting line, developing obstacle immunity, making thousands of small decisions and your gritty oath.",PhilosophersNotes,Sports
Optimal Business 101,How to create a great business and get paid to change the world,,"Over the last 20 years, I’ve spent half my time in Founder/CEO-mode and the other half in Philosopher-mode. Before going all in as a Philosopher, I built and sold two market-leading social platforms (raising $10m in the process). In this class, I share my Top 10 Ideas on how to create a great business and get paid to change the world. Whether you’re an aspiring entrepreneur, solopreneur, small business owner or leader in any organization, we hope you love it.",101 Classes,Business
Unstoppable Teams 101,The essentials for high-performance leadership,,"Alden Mills joins us as a guest teacher for this class! Drawing on over 25 years of high-performance leadership and team-building as a three-time Navy SEAL platoon commander and CEO of one of the INC Magazine’s fastest-growing consumer products companies in America, Alden illustrates his essentials for high-performance leadership and introduces us to 10 Big Ideas from his newest book, Unstoppable Teams, including his most successful leadership framework called C.A.R.E.",101 Classes,Business
The Effective Executive,The Definitive Guide to Getting the Right Things Done,Peter F. Drucker,"Peter Drucker is considered the father of modern management. This book was originally published in 1967. It’s *remarkably* well written and lucid. And, of course, packed with Big Ideas on how to optimize our effectiveness. We cover the 5 key practices/habits of the effective executive: time (first things first; second things never!), contribution (what can you contribute?), strengths (make yours productive; make weaknesses irrelevant), concentration (the secret to effectiveness), decisions (boundary conditions help).",PhilosophersNotes,Business
The 4 Disciplines of Execution,Achieving Your Wildly Important Goals,Chris McChesney & Sean Covey & Jim Huling,"I planned to read this book since Cal Newport referenced it in Deep Work. I finally did so in preparation to teach Productivity 101. It’s fantastic. If you’re a business leader or entrepreneur I think you’ll particularly enjoy it. Big Ideas we cover include the 4DX, the whirlwind, your Wildly Important Goals, Lag vs. Lead measures, the power of keeping score, and avoiding the blackhole of the magnificently trivial.",PhilosophersNotes,Business
